{
  "schemaVersion": "1.0",
  "query": {
    "mode": "lookup",
    "itemId": "minecraft:crafting_table"
  },
  "selectedRecipe": 0,
  "recipes": [
    {
      "recipeId": "minecraft:crafting_table",
      "recipeType": "shaped",
      "source": {
        "kind": "server_registry",
        "providerId": null
      },
      "result": {
        "itemId": "minecraft:crafting_table",
        "count": 1,
        "components": {}
      },
      "layout": {
        "width": 2,
        "height": 2,
        "ingredients": [
          {
            "slot": 0,
            "x": 0,
            "y": 0,
            "ingredient": {
              "choiceType": "tag",
              "tagId": "minecraft:planks",
              "alternatives": [
                {
                  "itemId": "minecraft:oak_planks",
                  "count": 1,
                  "components": {}
                },
                {
                  "itemId": "minecraft:spruce_planks",
                  "count": 1,
                  "components": {}
                }
              ]
            }
          },
          {
            "slot": 1,
            "x": 1,
            "y": 0,
            "ingredient": {
              "choiceType": "tag",
              "tagId": "minecraft:planks",
              "alternatives": [
                {
                  "itemId": "minecraft:oak_planks",
                  "count": 1,
                  "components": {}
                }
              ]
            }
          },
          {
            "slot": 2,
            "x": 0,
            "y": 1,
            "ingredient": {
              "choiceType": "tag",
              "tagId": "minecraft:planks",
              "alternatives": [
                {
                  "itemId": "minecraft:oak_planks",
                  "count": 1,
                  "components": {}
                }
              ]
            }
          },
          {
            "slot": 3,
            "x": 1,
            "y": 1,
            "ingredient": {
              "choiceType": "tag",
              "tagId": "minecraft:planks",
              "alternatives": [
                {
                  "itemId": "minecraft:oak_planks",
                  "count": 1,
                  "components": {}
                }
              ]
            }
          }
        ]
      },
      "remainingItems": []
    }
  ]
}
